Comment,Designator,Footprint,LCSC Part #
"6.8n",C1 C2 C3 C4 C5 C6 C7 C8 C9 C10 C11 C12 C13 C14 ,"Capacitor_SMD:C_0603_1608Metric","C1631"
"D_Schottky",D1 D2 D3 D4 D5 D6 D7 D8 D17 D18 D21 D22 D27 D28 ,"Diode_SMD:D_SMF","C156309"
"LED",D25 D26 D10 D9 D12 D11 D14 D13 D16 D15 D20 D19 D24 D23 D30 D29 ,"LED_SMD:LED_0603_1608Metric","C2286"
"Conn_02x39_Odd_Even",J1 ,"Connector_PinHeader_2.54mm:PinHeader_2x39_P2.54mm_Vertical",
"1k",R1 R2 R18 R17 R5 R6 R20 R19 R9 R10 R22 R21 R13 R14 R24 R23 R25 R26 R30 R29 R31 R32 R36 R35 R39 R40 R44 R43 ,"Resistor_SMD:R_0603_1608Metric","C21190"
"330",R37 ,"Resistor_SMD:R_0603_1608Metric","C23025"
"1.5k",R38 ,"Resistor_SMD:R_0603_1608Metric","C25867"
"10k",R4 R3 R8 R7 R12 R11 R16 R15 R28 R27 R34 R33 R42 R41 ,"Resistor_SMD:R_0603_1608Metric","C25804"
"VNLD5090",U1 U2 U3 U4 U5 U6 U7 ,"Package_SO:SO-8_3.9x4.9mm_P1.27mm","C377942"
